{
    "cohortId": "COHORT1",
    "endUsers": ["anoronh4", "enduser2"], 
    "pmUsers": ["pmuser1"], 
    "type": "investigator", 
    "projectTitle": "Genomic characterization of Responders", 
    "projectSubtitle": "Project_12345",
    "samples": [
        {"cmoId": "C-AAAAAA-P001-d", "normalCmoId": "C-AAAAAA-N001-d"},
        {"cmoId": "C-BBBBBB-P001-d", "normalCmoId": "C-BBBBBB-N001-d"}
    ]
}
